<?xml version="1.0" encoding="UTF-8"?>
<company xmlns="http://sap.com/moin/xm/test/Person"
	xmlns:xsi="http://www.w3.org/2001/XMLSchema-instance"
	xsi:schemaLocation="http://sap.com/moin/xm/test/Person testPerson.xsd">

	<employee>
		<name>hugo</name>
		<title>Dr</title>
		<address>
			<town>Munich</town>
			<street>
				<name>Siemensstraße</name>
				<number>12</number>
			</street>
		</address>
		<address>
			<town>Stuttgart</town>
			<street>
				<name>Hellstraße</name>
				<number>1</number>
			</street>
		</address>
		<equipment id="PC"></equipment>
		<equipment id="Laptop"></equipment>
	</employee>
	<customer>
		<name>Müller</name>
		<title>Master of Sience</title>
		<address>
			<town>Frankfurt</town>
			<street>
				<name>Bernauerstraße</name>
				<number>5</number>
			</street>
		</address>
	</customer>
	<employee>
		<name>Berta</name>
		<title>Dipl. Ing.</title>
		<address>
			<town>Berlin</town>
			<street>
				<name>Boschstraße</name>
				<number>2</number>
			</street>
		</address>
		<equipment id="Bycicle"></equipment>
		<equipment id="Car"></equipment>
	</employee>

</company>